{
  "schema": "https://pai.ink/schemas/ai-audit/v1.json",
  "schema_version": "1.0",
  "article": {
    "id": "3413648d-9395-4d1c-942d-5f2a3a026b26",
    "title": "NextEra Energy — 权益研究",
    "category": "finance",
    "language": "zh-CN",
    "content_sha256": "2751eb3113a9f5316cbefc60697373e45a393e3ab5872344331d17fbb567f690",
    "content_path": "index.html",
    "assets": [
      {
        "path": "cards/01_cover.png",
        "sha256": "9c140eae512b509c144966feb8a7d0f6776232574c8bf07ef312d52d96450a15",
        "media_type": "image/png"
      },
      {
        "path": "cards/02_background_industry.png",
        "sha256": "d80882fc390b62d851605129e93cf8b5cb953463e8a158f1da410cccb0e67403",
        "media_type": "image/png"
      },
      {
        "path": "cards/03_revenue.png",
        "sha256": "9e6996645c053bf364083428b6a15a49cb9fca8b37b0ed056f29a8b4f8745b40",
        "media_type": "image/png"
      },
      {
        "path": "cards/04_business_outlook.png",
        "sha256": "c13ee0de04ec48306d611edc5ef66e9213712dc6a89dfe3cbbef9810f8833602",
        "media_type": "image/png"
      },
      {
        "path": "cards/05_brand.png",
        "sha256": "46f2f48c6183539147a0d69fbbc9295810560e369cb00e26532d9adc4a96769d",
        "media_type": "image/png"
      },
      {
        "path": "cards/06_post_copy.png",
        "sha256": "4e4c4fa364d134c5481c65b69cb2561e3cf558505a4782188b14eb933e705fb1",
        "media_type": "image/png"
      }
    ],
    "word_count": 3011,
    "subtitle": "全球最大再生能源公用事业的护城河复盘",
    "tags": [
      "NEE",
      "公用事业",
      "新能源"
    ]
  },
  "skill": {
    "name": "Anamnesis Research",
    "repo_url": "https://github.com/pppop00/anamnesis-research",
    "repo_commit": "53d77d9275e42ff528fe306cd042e560c5e88fdb"
  },
  "generation": {
    "model": "claude-opus-4-7",
    "harness": "claude-code-cli",
    "started_at": "2026-05-15T03:57:46.859217Z",
    "finished_at": "2026-05-15T03:57:46.859433Z"
  },
  "author": {
    "github": "pppop00",
    "display_name": "Zelong"
  }
}
