{
  "schema": "https://pai.ink/schemas/ai-audit/v1.json",
  "schema_version": "1.0",
  "article": {
    "id": "18167a38-34bf-44ab-8c88-0b40f45c4039",
    "title": "中国广核 — 权益研究",
    "category": "finance",
    "language": "zh-CN",
    "content_sha256": "da9289f4cddda2dc9323b7fa6d0a05e62c1ae15116f796c87cfb8eb1d9dea98c",
    "content_path": "index.html",
    "assets": [
      {
        "path": "cards/01_cover.png",
        "sha256": "1c96bc92533e10beee825e1beaaf9936e1abb3015006d6f1259f50b3174532ce",
        "media_type": "image/png"
      },
      {
        "path": "cards/02_background_industry.png",
        "sha256": "c3bee1ddf9515c32dbfcdcd95154bd2f78e5ce9a499d83e8b1c0391e45835cf4",
        "media_type": "image/png"
      },
      {
        "path": "cards/03_revenue.png",
        "sha256": "a746b8783e86d5bfe1378a2c13f862332e39e3ea55388821aa71eadcef870284",
        "media_type": "image/png"
      },
      {
        "path": "cards/04_business_outlook.png",
        "sha256": "c2fdc33abac3b9063b04c56fd406243503f615a4f386bd9dd26ed733ecd94801",
        "media_type": "image/png"
      },
      {
        "path": "cards/05_brand.png",
        "sha256": "2a568af0d6d70935fa65865ed413066b007cb5d01370ab0f40110094cbf470ea",
        "media_type": "image/png"
      },
      {
        "path": "cards/06_post_copy.png",
        "sha256": "8600cdcf6eaecfc0c8f03c51603764afcdaf0eeb3aef70fc0561c322fca1117d",
        "media_type": "image/png"
      }
    ],
    "word_count": 2982,
    "subtitle": "国内核电双寡头之一的成长与现金流",
    "tags": [
      "中广核",
      "核电",
      "公用事业"
    ]
  },
  "skill": {
    "name": "Anamnesis Research",
    "repo_url": "https://github.com/pppop00/anamnesis-research",
    "repo_commit": "53d77d9275e42ff528fe306cd042e560c5e88fdb"
  },
  "generation": {
    "model": "claude-opus-4-7",
    "harness": "claude-code-cli",
    "started_at": "2026-05-15T03:57:47.286394Z",
    "finished_at": "2026-05-15T03:57:47.286515Z"
  },
  "author": {
    "github": "pppop00",
    "display_name": "Zelong"
  }
}
