{
  "schema": "https://pai.ink/schemas/ai-audit/v1.json",
  "schema_version": "1.0",
  "article": {
    "id": "8b6d7a52-1e1d-4f2c-9a3b-2d4e5f6a7b8c",
    "title": "Apple Inc. — Q2 FY2026 Equity Research",
    "subtitle": "Services margin expansion offsets iPhone unit softness",
    "category": "finance",
    "tags": ["AAPL", "earnings", "services", "10-Q"],
    "language": "zh-CN",
    "content_sha256": "9c2f1b3a4d5e6f7a8b9c0d1e2f3a4b5c6d7e8f9a0b1c2d3e4f5a6b7c8d9e0f1a",
    "content_path": "index.html",
    "assets": [
      {
        "path": "assets/revenue-sankey.png",
        "sha256": "1a2b3c4d5e6f7a8b9c0d1e2f3a4b5c6d7e8f9a0b1c2d3e4f5a6b7c8d9e0f1a2b",
        "media_type": "image/png"
      },
      {
        "path": "assets/segment-table.csv",
        "sha256": "2b3c4d5e6f7a8b9c0d1e2f3a4b5c6d7e8f9a0b1c2d3e4f5a6b7c8d9e0f1a2b3c",
        "media_type": "text/csv"
      }
    ],
    "word_count": 4321
  },
  "skill": {
    "name": "Equity Research Skill",
    "version": "1.2.0",
    "repo_url": "https://github.com/pppop00/equity-research-skill",
    "repo_commit": "a1b2c3d4e5f6a7b8c9d0e1f2a3b4c5d6e7f8a9b0",
    "skill_md_sha256": "3c4d5e6f7a8b9c0d1e2f3a4b5c6d7e8f9a0b1c2d3e4f5a6b7c8d9e0f1a2b3c4d",
    "entry_file": "SKILL.md"
  },
  "generation": {
    "model": "claude-opus-4-7",
    "harness": "claude-code-cli",
    "started_at": "2026-05-14T03:21:00Z",
    "finished_at": "2026-05-14T03:48:12Z",
    "prompt_template_sha256": "4d5e6f7a8b9c0d1e2f3a4b5c6d7e8f9a0b1c2d3e4f5a6b7c8d9e0f1a2b3c4d5e",
    "user_inputs": [
      { "role": "ticker", "value": "AAPL" },
      {
        "role": "filing_10q_url",
        "url": "https://www.sec.gov/cgi-bin/browse-edgar?action=getcompany&CIK=0000320193&type=10-Q&dateb=&owner=include&count=40",
        "sha256": "5e6f7a8b9c0d1e2f3a4b5c6d7e8f9a0b1c2d3e4f5a6b7c8d9e0f1a2b3c4d5e6f",
        "media_type": "application/pdf"
      },
      { "role": "comparable_set", "value": "MSFT, GOOGL, AMZN, META" }
    ],
    "transcript_sha256": "6f7a8b9c0d1e2f3a4b5c6d7e8f9a0b1c2d3e4f5a6b7c8d9e0f1a2b3c4d5e6f7a",
    "transcript_storage": "ipfs://bafybeigdyrzt5sfp7udm7hu76uh7y26nf3efuylqabf3oclgtqy55fbzdi",
    "reproducibility_note": "Single pass. No manual edits to model output. Final HTML was minified by the skill's build script (deterministic). Two retries on the SEC fetch due to rate limiting; transcript covers the successful run only."
  },
  "author": {
    "github": "pppop00",
    "display_name": "Zelong"
  },
  "signature": {
    "alg": "ed25519",
    "public_key": "MCowBQYDK2VwAyEAGb9ECWmEzf6FQbrBZ9w7lshQhqowtrbLDFw4rXAxZuE=",
    "sig": "RhYQ8jHkV1jY3KQqXNuCwH4F0n0sRk6mE6m3F8h1pV3W8gQy8KQ0YQ8jHkV1jY3KQqXNuCwH4F0n0sRk6mE6m3F8h1pV3W8gQy8KQ0Y="
  }
}
